{"city": "Berlin", "facts": [{"id": "fact_001", "text": "Estrel Berlin na Sonnenallee 225 je podle svého provozovatele evropským největším hotelovým, zábavním a kongresovým komplexem. Jeho Estrel Congress Center nabízí 30 000 m² eventové plochy v 85 sálech a prostor až pro 15 000 hostů. Komplex spojuje hotel, kongresové centrum a showtheater a má tak v jednom místě mimořádně silnou vazbu na berlínský kongresový a zábavní průmysl.", "title": "Estrel Berlin – evropský obří hotelový a kongresový komplex", "sources": ["https://www.estrel.com/de/kontakt-lage-und-anfahrtcongress", "https://www.estrel.com/de/kontakt-lage-und-anfahrt"], "category": "culture_and_industry", "priority": "A"}, {"id": "fact_002", "text": "S-Bahnhof Köllnische Heide vznikl na železniční spojce mezi Neuköllnem a Baumschulenwegem, jejíž trať existovala už od roku 1896. Stanice byla dokončena a otevřena v roce 1920 podle návrhů Karla Cornelia a Heinricha Besta a její historický areál s nádražní budovou a služebním domem je dnes veden jako berlínská kulturní památka.", "title": "Památkově chráněný S-Bahnhof Köllnische Heide", "sources": ["https://denkmaldatenbank.berlin.de/daobj.php?obj_dok_nr=09090456", "https://www.berlin.de/ba-neukoelln/_assets/bilder/stadtentwicklungsamt/stadtplanung/flyer-neue-perspektiven.pdf"], "category": "heritage_and_monuments", "priority": "A"}, {"id": "fact_003", "text": "Po stavbě Berlínské zdi v roce 1961 se Köllnische Heide ocitla jen kousek od hranice mezi východním a západním Berlínem a stanice se stala koncovou stanicí západoberlínských vlaků. Po stávce zaměstnanců Reichsbahn byl provoz na trati v letech 1980 až 1993 přerušen; po rekonstrukci se S-Bahn na Köllnische Heide vrátila v roce 1993.", "title": "Köllnische Heide a příběh rozdělené železnice", "sources": ["https://www.berlin.de/ba-neukoelln/_assets/bilder/stadtentwicklungsamt/stadtplanung/flyer-neue-perspektiven.pdf", "https://www.bahnhof.de/berlin-koellnische-heide"], "category": "history", "priority": "A"}, {"id": "fact_004", "text": "Na dnešní Chris-Gueffroy-Allee v území PSČ 12057 byl 5. února 1989 při pokusu překonat zařízení na hranici zastřelen dvacetiletý Chris Gueffroy. Berlínský turistický portál toto místo uvádí jako místo, kde byl zabit poslední uprchlík, který byl při pokusu překonat hranici zastřelen; jeho památku připomíná pamětní stéla.", "title": "Chris Gueffroy – poslední zabitý uprchlík na Berlínské zdi", "sources": ["https://www.berlin.de/tourismus-neukoelln/erleben/artikel.1154079.php"], "category": "hidden_gem", "priority": "B"}, {"id": "fact_005", "text": "High-Deck-Siedlung vznikala v letech 1975 až 1984 jako sociální bytová výstavba podle vítězného návrhu architektů Rainera Oefeleina a Bernharda Freunda. Její neobvyklý princip odděluje pěší pohyb od automobilové dopravy: vyvýšené, zelení obklopené pěší komunikace – takzvané High-Decks – vedou nad ulicemi a parkovacími místy. Berlín ji dnes eviduje jako památkově chráněný celek.", "title": "High-Deck-Siedlung – experiment se „silnicí dole, chodníkem nahoře“", "sources": ["https://www.high-deck-quartier.de/info/quartier", "https://www.berlin.de/landesdenkmalamt/_assets/pdf-und-zip/denkmale/liste-karte-datenbank/dm_liste.pdf?ts=1762426495"], "category": "culture_and_industry", "priority": "C"}], "photo": null, "state": "Berlin", "county": "Berlin", "sources": [{"url": "https://www.berlin.de/sen/soziales/buergerschaftliches-engagement/stadtteilzentren/projektuebersicht/projektliste/index.php/detail/11", "type": "official", "title": "Stadtteilzentrum Köllnische Heide – Berlin.de"}, {"url": "https://denkmaldatenbank.berlin.de/daobj.php?obj_dok_nr=09090456", "type": "official", "title": "Denkmaldatenbank Berlin – S-Bahnhof Köllnische Heide"}, {"url": "https://www.estrel.com/de/kontakt-lage-und-anfahrtcongress", "type": "official", "title": "Estrel Tower – Estrel Berlin"}, {"url": "https://www.berlin.de/tourismus-neukoelln/erleben/artikel.1154079.php", "type": "official", "title": "Ost-Krone – Berlin Tourismus Neukölln"}, {"url": "https://www.high-deck-quartier.de/info/quartier", "type": "regional", "title": "High-Deck-Siedlung – Quartiersmanagement"}], "district": "Neukölln", "postcode": "12057", "access_point": {"lat": 52.469444, "lon": 13.4675}, "translations": {"cs": {"facts": [{"id": "fact_001", "text": "Estrel Berlin na Sonnenallee 225 je podle svého provozovatele evropským největším hotelovým, zábavním a kongresovým komplexem. Jeho Estrel Congress Center nabízí 30 000 m² eventové plochy v 85 sálech a prostor až pro 15 000 hostů. Komplex spojuje hotel, kongresové centrum a showtheater a má tak v jednom místě mimořádně silnou vazbu na berlínský kongresový a zábavní průmysl.", "title": "Estrel Berlin – evropský obří hotelový a kongresový komplex"}, {"id": "fact_002", "text": "S-Bahnhof Köllnische Heide vznikl na železniční spojce mezi Neuköllnem a Baumschulenwegem, jejíž trať existovala už od roku 1896. Stanice byla dokončena a otevřena v roce 1920 podle návrhů Karla Cornelia a Heinricha Besta a její historický areál s nádražní budovou a služebním domem je dnes veden jako berlínská kulturní památka.", "title": "Památkově chráněný S-Bahnhof Köllnische Heide"}, {"id": "fact_003", "text": "Po stavbě Berlínské zdi v roce 1961 se Köllnische Heide ocitla jen kousek od hranice mezi východním a západním Berlínem a stanice se stala koncovou stanicí západoberlínských vlaků. Po stávce zaměstnanců Reichsbahn byl provoz na trati v letech 1980 až 1993 přerušen; po rekonstrukci se S-Bahn na Köllnische Heide vrátila v roce 1993.", "title": "Köllnische Heide a příběh rozdělené železnice"}, {"id": "fact_004", "text": "Na dnešní Chris-Gueffroy-Allee v území PSČ 12057 byl 5. února 1989 při pokusu překonat zařízení na hranici zastřelen dvacetiletý Chris Gueffroy. Berlínský turistický portál toto místo uvádí jako místo, kde byl zabit poslední uprchlík, který byl při pokusu překonat hranici zastřelen; jeho památku připomíná pamětní stéla.", "title": "Chris Gueffroy – poslední zabitý uprchlík na Berlínské zdi"}, {"id": "fact_005", "text": "High-Deck-Siedlung vznikala v letech 1975 až 1984 jako sociální bytová výstavba podle vítězného návrhu architektů Rainera Oefeleina a Bernharda Freunda. Její neobvyklý princip odděluje pěší pohyb od automobilové dopravy: vyvýšené, zelení obklopené pěší komunikace – takzvané High-Decks – vedou nad ulicemi a parkovacími místy. Berlín ji dnes eviduje jako památkově chráněný celek.", "title": "High-Deck-Siedlung – experiment se „silnicí dole, chodníkem nahoře“"}], "representative_place": "Köllnische Heide, Estrel Tower a High-Deck-Siedlung"}, "de": {"facts": [{"id": "fact_001", "text": "Der Estrel Tower an der Sonnenallee ist 176 Meter hoch und hat 45 Geschosse. Er gehört zum Estrel Berlin und soll nach seiner Fertigstellung das höchste Gebäude Berlins sein; der Betreiber nennt Ende 2026 als Eröffnungstermin. Der Turm verbindet Hotelzimmer, Serviced Apartments, Restaurants und Bars, Wellness, Coworking sowie Kongress- und Veranstaltungsflächen.", "title": "Estrel Tower – neue Hochhausmarke Berlins"}, {"id": "fact_002", "text": "Der S-Bahnhof Köllnische Heide entstand an der Verbindungsbahn zwischen Neukölln und Baumschulenweg, deren Strecke bereits seit 1896 bestand. Die Station wurde 1920 nach Entwürfen von Karl Cornelius und Heinrich Best fertiggestellt und eröffnet; die historische Anlage mit Empfangsgebäude und Beamtenwohnhaus steht heute unter Denkmalschutz.", "title": "Der denkmalgeschützte S-Bahnhof Köllnische Heide"}, {"id": "fact_003", "text": "Nach dem Bau der Berliner Mauer 1961 lag Köllnische Heide nur wenige hundert Meter von der Grenze zwischen Ost- und West-Berlin entfernt und wurde zum Endbahnhof westlicher S-Bahn-Züge. Nach dem Reichsbahnerstreik wurde der Verkehr auf der Strecke von 1980 bis 1993 eingestellt; nach der Sanierung nahm die S-Bahn 1993 den Betrieb wieder auf.", "title": "Köllnische Heide und die Geschichte der geteilten Eisenbahn"}, {"id": "fact_004", "text": "An der heutigen Chris-Gueffroy-Allee im Gebiet der PLZ 12057 wurde am 5. Februar 1989 der zwanzigjährige Chris Gueffroy bei seinem Fluchtversuch erschossen. Das Berliner Tourismusportal bezeichnet ihn als den letzten Flüchtling, der bei einem Versuch, die DDR-Grenzanlagen zu überwinden, erschossen wurde; eine Gedenkstele erinnert an ihn.", "title": "Chris Gueffroy – der letzte an der Berliner Mauer erschossene Flüchtling"}, {"id": "fact_005", "text": "Die High-Deck-Siedlung entstand von 1975 bis 1984 als sozialer Wohnungsbau nach dem Wettbewerbsentwurf der Architekten Rainer Oefelein und Bernhard Freund. Ihr ungewöhnliches städtebauliches Prinzip trennt Fuß- und Autoverkehr: Begrünte, erhöhte Fußwege – die namensgebenden High-Decks – verlaufen über Straßen und Stellplätzen. Berlin führt die Siedlung heute als geschütztes Denkmalensemble.", "title": "High-Deck-Siedlung – Straßen unten, Wege oben"}], "representative_place": "Köllnische Heide, Estrel Tower und High-Deck-Siedlung"}, "en": {"facts": [{"id": "fact_001", "text": "The Estrel Tower on Sonnenallee rises 176 metres and has 45 floors. It is part of Estrel Berlin and is intended to become Berlin’s tallest building once completed; the operator lists the end of 2026 as the opening date. The tower combines hotel rooms, serviced apartments, restaurants and bars, wellness, coworking and congress and event spaces.", "title": "Estrel Tower – Berlin’s new high-rise landmark"}, {"id": "fact_002", "text": "Köllnische Heide station was built on the railway link between Neukölln and Baumschulenweg, whose route had existed since 1896. The station was completed and opened in 1920 to designs by Karl Cornelius and Heinrich Best; its historic complex with station building and railway staff residence is now protected as a Berlin monument.", "title": "The listed Köllnische Heide S-Bahn station"}, {"id": "fact_003", "text": "After the Berlin Wall was built in 1961, Köllnische Heide lay only a short distance from the border between East and West Berlin